{
  "$schema": "http://json-schema.org/draft-07/schema#",
  "title": "InteractiveDiagram",
  "type": "object",
  "required": ["schemaVersion", "id", "title", "nodes", "edges"],
  "additionalProperties": false,
  "properties": {
    "schemaVersion": { "const": 1 },
    "id": { "type": "string", "pattern": "^[a-z0-9-]+$" },
    "title": { "type": "string", "minLength": 1 },
    "description": { "type": "string" },
    "groups": { "type": "array", "items": { "$ref": "#/definitions/group" } },
    "nodes": { "type": "array", "items": { "$ref": "#/definitions/node" }, "minItems": 1 },
    "edges": { "type": "array", "items": { "$ref": "#/definitions/edge" } },
    "flows": { "type": "array", "items": { "$ref": "#/definitions/flow" } }
  },
  "definitions": {
    "position": {
      "type": "object",
      "required": ["x", "y"],
      "additionalProperties": false,
      "properties": { "x": { "type": "number" }, "y": { "type": "number" } }
    },
    "nodeType": {
      "enum": [
        "client", "client_mobile", "dns", "cdn", "load_balancer",
        "server", "server_stack", "database", "database_stack", "nosql",
        "cache", "cache_stack", "message_queue", "worker_stack",
        "service", "text_box", "table"
      ]
    },
    "node": {
      "type": "object",
      "required": ["id", "type", "label", "position"],
      "additionalProperties": false,
      "properties": {
        "id": { "type": "string", "pattern": "^[a-z0-9_]+$" },
        "type": { "$ref": "#/definitions/nodeType" },
        "label": { "type": "string" },
        "sublabel": { "type": "string" },
        "position": { "$ref": "#/definitions/position" },
        "groupId": { "type": "string" },
        "badge": { "type": "integer", "minimum": 1, "maximum": 99 },
        "state": { "enum": ["normal", "highlighted", "failed", "dimmed"], "default": "normal" },
        "tableData": {
          "type": "object",
          "required": ["columns", "rows"],
          "additionalProperties": false,
          "properties": {
            "columns": { "type": "array", "items": { "type": "string" } },
            "rows": { "type": "array", "items": { "type": "array", "items": { "type": "string" } } }
          }
        }
      }
    },
    "handleSide": { "enum": ["top", "bottom", "left", "right"] },
    "edge": {
      "type": "object",
      "required": ["id", "source", "target"],
      "additionalProperties": false,
      "properties": {
        "id": { "type": "string", "pattern": "^[a-z0-9_]+$" },
        "source": { "type": "string" },
        "target": { "type": "string" },
        "label": { "type": "string" },
        "step": { "type": "integer", "minimum": 1, "maximum": 99 },
        "lineStyle": { "enum": ["solid", "dashed"], "default": "solid" },
        "color": { "enum": ["blue", "green", "purple", "red", "gray"], "default": "blue" },
        "direction": { "enum": ["forward", "both", "none"], "default": "forward" },
        "sourceHandle": { "$ref": "#/definitions/handleSide" },
        "targetHandle": { "$ref": "#/definitions/handleSide" }
      }
    },
    "group": {
      "type": "object",
      "required": ["id", "position", "size", "style"],
      "additionalProperties": false,
      "properties": {
        "id": { "type": "string", "pattern": "^[a-z0-9_]+$" },
        "label": { "type": "string" },
        "position": { "$ref": "#/definitions/position" },
        "size": {
          "type": "object",
          "required": ["width", "height"],
          "additionalProperties": false,
          "properties": { "width": { "type": "number" }, "height": { "type": "number" } }
        },
        "style": { "enum": ["dashed", "solid", "filled"] },
        "labelPosition": { "enum": ["top-left", "top-right", "right", "bottom"], "default": "top-left" }
      }
    },
    "flow": {
      "type": "object",
      "required": ["id", "name", "steps"],
      "additionalProperties": false,
      "properties": {
        "id": { "type": "string", "pattern": "^[a-z0-9-]+$" },
        "name": { "type": "string" },
        "description": { "type": "string" },
        "kind": { "enum": ["path", "notes"] },
        "steps": {
          "type": "array",
          "minItems": 1,
          "items": {
            "type": "object",
            "required": ["edgeIds", "text"],
            "additionalProperties": false,
            "properties": {
              "edgeIds": { "type": "array", "items": { "type": "string" }, "minItems": 1 },
              "text": { "type": "string" }
            }
          }
        }
      }
    }
  }
}
