{
  "schemaVersion": 1,
  "id": "web-data-tier",
  "title": "Web tier + data tier with load balancer and replication",
  "description": "Users resolve DNS, hit the load balancer, which fans out to stateless web servers backed by master-slave replication.",
  "groups": [
    {
      "id": "g_user",
      "label": "User",
      "position": {
        "x": 280,
        "y": 0
      },
      "size": {
        "width": 360,
        "height": 150
      },
      "style": "solid"
    },
    {
      "id": "g_web",
      "label": "Web tier",
      "position": {
        "x": 280,
        "y": 420
      },
      "size": {
        "width": 360,
        "height": 160
      },
      "style": "dashed",
      "labelPosition": "right"
    },
    {
      "id": "g_data",
      "label": "Data tier",
      "position": {
        "x": 240,
        "y": 680
      },
      "size": {
        "width": 440,
        "height": 170
      },
      "style": "dashed",
      "labelPosition": "right"
    }
  ],
  "nodes": [
    {
      "id": "browser",
      "type": "client",
      "label": "Web browser",
      "position": {
        "x": 220,
        "y": 40
      },
      "groupId": "g_user"
    },
    {
      "id": "mobile",
      "type": "client_mobile",
      "label": "Mobile app",
      "position": {
        "x": 40,
        "y": 40
      },
      "groupId": "g_user"
    },
    {
      "id": "dns",
      "type": "dns",
      "label": "DNS",
      "position": {
        "x": 800,
        "y": 40
      }
    },
    {
      "id": "lb",
      "type": "load_balancer",
      "label": "Load balancer",
      "position": {
        "x": 420,
        "y": 260
      }
    },
    {
      "id": "web1",
      "type": "server",
      "label": "Server 1",
      "position": {
        "x": 50,
        "y": 40
      },
      "groupId": "g_web"
    },
    {
      "id": "web2",
      "type": "server",
      "label": "Server 2",
      "position": {
        "x": 210,
        "y": 40
      },
      "groupId": "g_web"
    },
    {
      "id": "master",
      "type": "database",
      "label": "Master DB",
      "sublabel": "writes",
      "position": {
        "x": 50,
        "y": 50
      },
      "groupId": "g_data"
    },
    {
      "id": "slave",
      "type": "database",
      "label": "Slave DB",
      "sublabel": "reads",
      "position": {
        "x": 280,
        "y": 50
      },
      "groupId": "g_data"
    }
  ],
  "edges": [
    {
      "id": "e_dns",
      "source": "browser",
      "target": "dns",
      "label": "www.mysite.com",
      "step": 1,
      "sourceHandle": "right",
      "targetHandle": "left",
      "direction": "both"
    },
    {
      "id": "e_lb",
      "source": "browser",
      "target": "lb",
      "label": "HTTP request",
      "step": 2,
      "sourceHandle": "bottom",
      "targetHandle": "top"
    },
    {
      "id": "e_w1",
      "source": "lb",
      "target": "web1",
      "step": 3,
      "sourceHandle": "bottom",
      "targetHandle": "top"
    },
    {
      "id": "e_w2",
      "source": "lb",
      "target": "web2",
      "step": 3,
      "sourceHandle": "bottom",
      "targetHandle": "top"
    },
    {
      "id": "e_write",
      "source": "web1",
      "target": "master",
      "label": "write",
      "color": "blue",
      "sourceHandle": "bottom",
      "targetHandle": "top"
    },
    {
      "id": "e_read",
      "source": "web2",
      "target": "slave",
      "label": "read",
      "color": "green",
      "sourceHandle": "bottom",
      "targetHandle": "top"
    },
    {
      "id": "e_repl",
      "source": "master",
      "target": "slave",
      "label": "replicate",
      "lineStyle": "dashed",
      "color": "gray",
      "sourceHandle": "right",
      "targetHandle": "left"
    }
  ],
  "flows": [
    {
      "id": "read-request",
      "name": "A user reads data",
      "steps": [
        {
          "edgeIds": [
            "e_dns"
          ],
          "text": "The browser resolves www.mysite.com via DNS and receives the load balancer's public IP."
        },
        {
          "edgeIds": [
            "e_lb"
          ],
          "text": "The HTTP request goes to the load balancer — web servers are not reachable directly."
        },
        {
          "edgeIds": [
            "e_w1",
            "e_w2"
          ],
          "text": "The load balancer forwards the request to a healthy web server over private IPs."
        },
        {
          "edgeIds": [
            "e_read"
          ],
          "text": "The web server reads from a slave replica; reads scale by adding replicas."
        },
        {
          "edgeIds": [
            "e_repl"
          ],
          "text": "The master asynchronously replicates writes to slaves in the background."
        },
        {
          "edgeIds": [
            "e_write"
          ],
          "text": "Writes take the other path: they go only to the master. Sending them to a replica would create two divergent histories with no way to reconcile them — which is why the split is read-replica, not peer-to-peer."
        }
      ]
    }
  ]
}
