{
  "schemaVersion": 1,
  "id": "frontier-loop",
  "title": "The crawl loop, and the filter that stops it running forever",
  "description": "A crawler is a cycle: fetch, parse, discover new links, feed them back. The interesting parts are what keeps that cycle polite and what keeps it from revisiting the same pages endlessly.",
  "nodes": [
    { "id": "seeds", "type": "text_box", "label": "Seed URLs", "sublabel": "the starting set", "position": { "x": 40, "y": 90 } },
    { "id": "frontier", "type": "message_queue", "label": "URL frontier", "sublabel": "one queue per host", "position": { "x": 300, "y": 95 }, "badge": 1 },
    { "id": "fetchers", "type": "worker_stack", "label": "Fetchers", "sublabel": "respect robots.txt", "position": { "x": 610, "y": 85 }, "badge": 2 },
    { "id": "parser", "type": "server", "label": "Parser", "sublabel": "extract links + text", "position": { "x": 610, "y": 350 }, "badge": 3 },
    { "id": "dedup", "type": "cache", "label": "Seen-URL filter", "sublabel": "Bloom filter", "position": { "x": 300, "y": 350 }, "badge": 4 },
    { "id": "store", "type": "database_stack", "label": "Content store", "sublabel": "pages + checksums", "position": { "x": 880, "y": 350 } }
  ],
  "edges": [
    { "id": "e_seed", "source": "seeds", "target": "frontier", "label": "prime", "sourceHandle": "right", "targetHandle": "left" },
    { "id": "e_pull", "source": "frontier", "target": "fetchers", "label": "next URL", "step": 1, "sourceHandle": "right", "targetHandle": "left" },
    { "id": "e_parse", "source": "fetchers", "target": "parser", "label": "HTML", "step": 2, "color": "green", "sourceHandle": "bottom", "targetHandle": "top" },
    { "id": "e_store", "source": "parser", "target": "store", "label": "persist page", "step": 3, "color": "green", "sourceHandle": "right", "targetHandle": "left" },
    { "id": "e_dedup", "source": "parser", "target": "dedup", "label": "discovered links", "step": 4, "color": "purple", "sourceHandle": "bottom", "targetHandle": "left", "direction": "both" },
    { "id": "e_loop", "source": "dedup", "target": "frontier", "label": "unseen URLs only", "step": 5, "color": "purple", "sourceHandle": "bottom", "targetHandle": "top" }
  ],
  "flows": [
    {
      "id": "cycle",
      "name": "One turn of the loop",
      "steps": [
        { "edgeIds": ["e_pull"], "text": "A fetcher takes the next URL. The frontier is not one queue — it is a queue per host, so that politeness can be enforced by rate-limiting each host independently while the crawler as a whole stays busy." },
        { "edgeIds": ["e_parse"], "text": "The page is fetched, subject to robots.txt and a per-host delay, and handed to the parser." },
        { "edgeIds": ["e_store"], "text": "Content is persisted with a checksum, so a page whose bytes have not changed since last crawl can be skipped cheaply next time." },
        { "edgeIds": ["e_dedup"], "text": "Extracted links are checked against the seen-URL filter. A Bloom filter answers 'definitely new' or 'probably seen' in constant space — at web scale an exact set of visited URLs does not fit in memory." },
        { "edgeIds": ["e_loop"], "text": "Only genuinely new URLs go back to the frontier, and the cycle repeats. Without this filter the crawler revisits the same pages forever and never reaches new ones." }
      ]
    },
    {
      "id": "traps",
      "name": "What breaks a naive crawler",
      "steps": [
        { "edgeIds": ["e_loop"], "text": "Crawler traps: calendars with infinite 'next month' links, or URLs with session IDs that make every request look like a new page. The filter never fires because the URLs really are new." },
        { "edgeIds": ["e_dedup"], "text": "Defences are depth limits per host, URL normalisation that strips known-volatile query parameters, and content checksums that catch pages which differ in URL but not in substance." },
        { "edgeIds": ["e_pull"], "text": "And a per-host budget, so one pathological domain cannot consume the whole crawl. The Bloom filter's false positives cut the same way: a small fraction of genuinely new pages are skipped, which is an acceptable trade for the memory saved." }
      ]
    }
  ]
}
