{
  "schemaVersion": 1,
  "id": "health-check-failover",
  "title": "Health checks turn a dead server into a non-event",
  "description": "A load balancer is only as good as its idea of 'healthy'. When a server fails its check it leaves the pool, and the users who would have hit it notice nothing.",
  "groups": [
    { "id": "g_pool", "label": "Server pool", "position": { "x": 200, "y": 420 }, "size": { "width": 470, "height": 170 }, "style": "dashed", "labelPosition": "right" }
  ],
  "nodes": [
    { "id": "client", "type": "client", "label": "Clients", "position": { "x": 380, "y": 30 } },
    { "id": "lb", "type": "load_balancer", "label": "Load balancer", "sublabel": "active health checks", "position": { "x": 370, "y": 240 } },
    { "id": "s1", "type": "server", "label": "Server 1", "sublabel": "healthy", "position": { "x": 50, "y": 45 }, "groupId": "g_pool" },
    { "id": "s2", "type": "server", "label": "Server 2", "sublabel": "failed check", "state": "failed", "position": { "x": 185, "y": 45 }, "groupId": "g_pool" },
    { "id": "s3", "type": "server", "label": "Server 3", "sublabel": "healthy", "position": { "x": 320, "y": 45 }, "groupId": "g_pool" },
    { "id": "note", "type": "text_box", "label": "Check what this instance controls", "sublabel": "A check that verifies a shared\ndatabase fails on every instance\nat once — removing the whole\nfleet and turning a degraded\ndependency into an outage.", "position": { "x": 760, "y": 250 } }
  ],
  "edges": [
    { "id": "e_req", "source": "client", "target": "lb", "label": "requests", "step": 1, "sourceHandle": "bottom", "targetHandle": "top" },
    { "id": "e_s1", "source": "lb", "target": "s1", "label": "routed", "step": 2, "color": "green", "sourceHandle": "bottom", "targetHandle": "top" },
    { "id": "e_s2", "source": "lb", "target": "s2", "label": "removed from pool", "step": 2, "color": "red", "lineStyle": "dashed", "direction": "none", "sourceHandle": "bottom", "targetHandle": "top" },
    { "id": "e_s3", "source": "lb", "target": "s3", "label": "routed", "step": 2, "color": "green", "sourceHandle": "bottom", "targetHandle": "top" }
  ],
  "flows": [
    {
      "id": "failover",
      "name": "A server dies mid-traffic",
      "steps": [
        { "edgeIds": ["e_req"], "text": "Clients address the load balancer, never an individual server. That indirection is what makes the next step invisible to them." },
        { "edgeIds": ["e_s2"], "text": "Server 2 stops passing its health check. The balancer stops sending it traffic — the dashed line is a path no longer taken, not a broken request." },
        { "edgeIds": ["e_s1", "e_s3"], "text": "Its share is absorbed by the survivors. Capacity drops by a third; availability does not change at all. This is the difference between a capacity event and an outage." }
      ]
    },
    {
      "id": "sticky",
      "name": "Why sticky sessions ruin this",
      "kind": "notes",
      "steps": [
        { "edgeIds": ["e_s2"], "text": "If sessions were pinned to Server 2, its users do not fail over gracefully — their session state died with the machine and they are logged out." },
        { "edgeIds": ["e_s1", "e_s3"], "text": "With a stateless tier and session state in a shared store, any server can serve any request, so a failure costs capacity rather than user sessions. That is the whole argument for statelessness." }
      ]
    }
  ]
}
