{
  "schemaVersion": 1,
  "id": "graph-sharding",
  "title": "Why graphs resist sharding",
  "description": "Sharding works when a query names its shard. A graph traversal does the opposite: it discovers where to go next only after reading the previous hop.",
  "nodes": [
    { "id": "app", "type": "server_stack", "label": "Application", "position": { "x": 40, "y": 250 } },
    { "id": "router", "type": "service", "label": "Shard router", "sublabel": "hash(user_id)", "position": { "x": 300, "y": 255 }, "badge": 1 },
    { "id": "s1", "type": "database", "label": "Shard 1", "sublabel": "users a–h", "position": { "x": 700, "y": 60 } },
    { "id": "s2", "type": "database", "label": "Shard 2", "sublabel": "users i–p", "position": { "x": 700, "y": 250 } },
    { "id": "s3", "type": "database", "label": "Shard 3", "sublabel": "users q–z", "position": { "x": 700, "y": 440 } },
    { "id": "note", "type": "text_box", "label": "An edge is a cross-shard fact", "sublabel": "Alice (shard 1) follows Zoe (shard 3).\nThe relationship belongs to neither\nmachine, so every traversal is a\nscatter-gather waiting to happen.", "position": { "x": 250, "y": 470 } },
    { "id": "fix", "type": "text_box", "label": "What actually helps", "sublabel": "• store the adjacency list denormalised\n  so one hop is one read\n• replicate very-high-degree nodes\n• co-locate communities on a shard\n• cap traversal depth in the API", "position": { "x": 960, "y": 250 } }
  ],
  "edges": [
    { "id": "e_q", "source": "app", "target": "router", "label": "query", "sourceHandle": "right", "targetHandle": "left", "direction": "both" },
    { "id": "e_s1", "source": "router", "target": "s1", "label": "shard 1", "color": "green", "sourceHandle": "right", "targetHandle": "left", "direction": "both" },
    { "id": "e_s2", "source": "router", "target": "s2", "label": "shard 2", "color": "green", "sourceHandle": "right", "targetHandle": "left", "direction": "both" },
    { "id": "e_s3", "source": "router", "target": "s3", "label": "shard 3", "color": "red", "sourceHandle": "right", "targetHandle": "left", "direction": "both" }
  ],
  "flows": [
    {
      "id": "one-hop",
      "name": "One hop — fine",
      "steps": [
        { "edgeIds": ["e_q"], "text": "\"Who does Alice follow?\" The query names Alice, so it names her shard." },
        { "edgeIds": ["e_s1"], "text": "One shard, one read. If the adjacency list is stored denormalised — Alice's followees as a list on her row — this is a single lookup rather than a join, and it is as fast as any other sharded query." }
      ]
    },
    {
      "id": "two-hops",
      "name": "Two hops — the problem",
      "steps": [
        { "edgeIds": ["e_s1"], "text": "\"Who do Alice's followees follow?\" Hop one returns a list of user IDs — and those IDs are scattered across every shard, because hashing deliberately destroyed locality." },
        { "edgeIds": ["e_s1", "e_s2", "e_s3"], "text": "Hop two must therefore query every shard. Latency is set by the slowest one, and the fan-out grows with each additional hop. Depth 3 on a well-connected graph can touch most of the cluster." },
        { "edgeIds": ["e_s3"], "text": "This is the fundamental tension: sharding needs the query to name its shard up front, and a traversal only learns where to go next after reading the previous hop. No shard key fixes that — it is a property of the access pattern." }
      ]
    },
    {
      "id": "mitigations",
      "name": "Living with it",
      "steps": [
        { "edgeIds": ["e_s1"], "text": "Denormalise the adjacency list so the common one-hop query never joins. Storage is cheap; cross-shard reads are not." },
        { "edgeIds": ["e_s3"], "text": "Replicate very-high-degree nodes — the accounts everyone follows — onto every shard, so traversals through them stay local. The same celebrity asymmetry as the news feed, solved the same way: handle the small expensive set differently." },
        { "edgeIds": ["e_q"], "text": "And cap depth in the API. \"Friends of friends\" is a product feature; unbounded traversal is a denial-of-service vector against your own database. If deep traversal is genuinely core, that is the argument for a purpose-built graph database rather than a sharded relational one." }
      ]
    }
  ]
}
