{
  "schemaVersion": 1,
  "id": "pull-cdn",
  "title": "A pull CDN: one user pays, everyone after them doesn't",
  "description": "The first request for an object in a region misses and is fetched from origin. Every subsequent request in that region is served from the edge, 20 ms away instead of 200.",
  "nodes": [
    {
      "id": "user_a",
      "type": "client",
      "label": "User A",
      "sublabel": "first in region",
      "position": {
        "x": 60,
        "y": 90
      }
    },
    {
      "id": "user_b",
      "type": "client_mobile",
      "label": "User B",
      "sublabel": "arrives later",
      "position": {
        "x": 60,
        "y": 380
      }
    },
    {
      "id": "edge",
      "type": "cdn",
      "label": "Edge",
      "sublabel": "~20 ms away",
      "position": {
        "x": 420,
        "y": 230
      },
      "badge": 1
    },
    {
      "id": "origin",
      "type": "server",
      "label": "Origin",
      "sublabel": "~200 ms away",
      "position": {
        "x": 830,
        "y": 230
      },
      "badge": 2
    },
    {
      "id": "note",
      "type": "text_box",
      "label": "What kills hit rate",
      "sublabel": "Cache-busting query strings,\nVary on a high-cardinality header,\nSet-Cookie on static assets,\nand needlessly short TTLs.",
      "position": {
        "x": 760,
        "y": 470
      }
    }
  ],
  "edges": [
    {
      "id": "e_a",
      "source": "user_a",
      "target": "edge",
      "label": "GET /logo.png",
      "step": 1,
      "sourceHandle": "right",
      "targetHandle": "left",
      "direction": "both"
    },
    {
      "id": "e_fetch",
      "source": "edge",
      "target": "origin",
      "label": "miss → fetch",
      "step": 2,
      "color": "red",
      "sourceHandle": "right",
      "targetHandle": "left",
      "direction": "both"
    },
    {
      "id": "e_b",
      "source": "user_b",
      "target": "edge",
      "label": "GET /logo.png",
      "step": 3,
      "color": "green",
      "sourceHandle": "right",
      "targetHandle": "left",
      "direction": "both"
    }
  ],
  "flows": [
    {
      "id": "cold",
      "name": "Cold: the first request in a region",
      "steps": [
        {
          "edgeIds": [
            "e_a"
          ],
          "text": "User A requests an asset. DNS pointed them at the nearest edge, so this hop is short."
        },
        {
          "edgeIds": [
            "e_fetch"
          ],
          "text": "The edge has never seen this object, so it fetches from origin — the full long-distance round trip. User A pays it, and the edge stores the response with its TTL."
        },
        {
          "edgeIds": [
            "e_a"
          ],
          "text": "User A gets the object. Their experience is no better than having no CDN, which is the honest cost of a pull CDN's first request."
        }
      ]
    },
    {
      "id": "warm",
      "name": "Warm: everyone afterwards",
      "steps": [
        {
          "edgeIds": [
            "e_b"
          ],
          "text": "User B requests the same object and it is served straight from the edge, roughly 20 ms away."
        },
        {
          "edgeIds": [
            "e_fetch"
          ],
          "text": "This is the path that is now NOT taken — origin sees nothing at all. Because popularity follows a steep power law, the overwhelming majority of requests skip this hop, and that ratio is exactly what hit rate measures. A hit-rate regression almost always means someone changed a header, not that traffic changed."
        }
      ]
    },
    {
      "id": "prewarm",
      "name": "Why you pre-warm a launch",
      "kind": "notes",
      "steps": [
        {
          "edgeIds": [
            "e_fetch"
          ],
          "text": "For a scheduled release, thousands of edges are all cold simultaneously. Every one of them misses at once and stampedes your origin — the CDN delivers the exact load it was meant to absorb."
        },
        {
          "edgeIds": [
            "e_a",
            "e_b"
          ],
          "text": "Pushing content to the edges before launch converts that spike into ordinary warm traffic. The same reasoning as cache warm-up, one layer out."
        }
      ]
    }
  ]
}
