{
  "schemaVersion": 1,
  "id": "mapreduce-pipeline",
  "title": "Precompute offline, serve instantly",
  "description": "The batch pipeline has no latency budget and does all the heavy computation. The serving path reads a precomputed answer. Neither constrains the other — which is the entire reason to separate them.",
  "groups": [
    {
      "id": "g_batch",
      "label": "Batch — runs on a schedule, may fail and retry",
      "position": {
        "x": 60,
        "y": 30
      },
      "size": {
        "width": 1000,
        "height": 210
      },
      "style": "filled",
      "labelPosition": "top-left"
    },
    {
      "id": "g_serve",
      "label": "Serving — reads only",
      "position": {
        "x": 60,
        "y": 400
      },
      "size": {
        "width": 620,
        "height": 190
      },
      "style": "dashed",
      "labelPosition": "right"
    }
  ],
  "nodes": [
    {
      "id": "events",
      "type": "database_stack",
      "label": "Raw event log",
      "sublabel": "append-only",
      "position": {
        "x": 20,
        "y": 55
      },
      "groupId": "g_batch"
    },
    {
      "id": "mappers",
      "type": "worker_stack",
      "label": "Mappers",
      "sublabel": "emit (key, value)",
      "position": {
        "x": 290,
        "y": 55
      },
      "groupId": "g_batch"
    },
    {
      "id": "shuffle",
      "type": "service",
      "label": "Shuffle & sort",
      "sublabel": "group by key",
      "position": {
        "x": 560,
        "y": 65
      },
      "groupId": "g_batch"
    },
    {
      "id": "reducers",
      "type": "worker_stack",
      "label": "Reducers",
      "sublabel": "aggregate per key",
      "position": {
        "x": 860,
        "y": 55
      },
      "groupId": "g_batch"
    },
    {
      "id": "results",
      "type": "database",
      "label": "Precomputed results",
      "sublabel": "swapped in atomically",
      "position": {
        "x": 860,
        "y": 300
      },
      "badge": 1
    },
    {
      "id": "users",
      "type": "client",
      "label": "Users",
      "position": {
        "x": 40,
        "y": 45
      },
      "groupId": "g_serve"
    },
    {
      "id": "api",
      "type": "service",
      "label": "Serving API",
      "position": {
        "x": 250,
        "y": 50
      },
      "groupId": "g_serve"
    },
    {
      "id": "cache",
      "type": "cache",
      "label": "Cache",
      "position": {
        "x": 460,
        "y": 45
      },
      "groupId": "g_serve"
    }
  ],
  "edges": [
    {
      "id": "e_map",
      "source": "events",
      "target": "mappers",
      "label": "read partitions",
      "step": 1,
      "color": "purple",
      "sourceHandle": "right",
      "targetHandle": "left"
    },
    {
      "id": "e_shuffle",
      "source": "mappers",
      "target": "shuffle",
      "label": "intermediate pairs",
      "step": 2,
      "color": "purple",
      "sourceHandle": "right",
      "targetHandle": "left"
    },
    {
      "id": "e_reduce",
      "source": "shuffle",
      "target": "reducers",
      "label": "grouped by key",
      "step": 3,
      "color": "purple",
      "sourceHandle": "right",
      "targetHandle": "left"
    },
    {
      "id": "e_write",
      "source": "reducers",
      "target": "results",
      "label": "write output",
      "step": 4,
      "color": "green",
      "sourceHandle": "bottom",
      "targetHandle": "top"
    },
    {
      "id": "e_user",
      "source": "users",
      "target": "api",
      "label": "request",
      "sourceHandle": "right",
      "targetHandle": "left",
      "direction": "both"
    },
    {
      "id": "e_cache",
      "source": "api",
      "target": "cache",
      "label": "lookup",
      "color": "purple",
      "sourceHandle": "right",
      "targetHandle": "left",
      "direction": "both"
    },
    {
      "id": "e_read",
      "source": "cache",
      "target": "results",
      "label": "on miss",
      "color": "green",
      "sourceHandle": "right",
      "targetHandle": "left",
      "direction": "both"
    }
  ],
  "flows": [
    {
      "id": "job",
      "name": "The job",
      "steps": [
        {
          "edgeIds": [
            "e_map"
          ],
          "text": "Mappers read partitions of the raw log in parallel and emit key-value pairs — say (category, sale_amount). Each mapper is independent, so this scales by adding machines."
        },
        {
          "edgeIds": [
            "e_shuffle"
          ],
          "text": "The shuffle groups every pair by key and routes each key to one reducer. This is the expensive step: it moves data across the network, and a single hot key sends everything to one reducer — the same skew problem as a hot shard."
        },
        {
          "edgeIds": [
            "e_reduce"
          ],
          "text": "Each reducer sees all values for its keys and aggregates them — summing, ranking, counting distinct."
        },
        {
          "edgeIds": [
            "e_write"
          ],
          "text": "Output is written as a complete new result set and swapped in atomically, rather than mutated in place. A failed job leaves the previous results serving, which is why batch failures are invisible to users."
        }
      ]
    },
    {
      "id": "serve",
      "name": "Serving the answer",
      "steps": [
        {
          "edgeIds": [
            "e_user",
            "e_cache"
          ],
          "text": "The user request never triggers computation. It reads a value that was calculated hours ago."
        },
        {
          "edgeIds": [
            "e_read"
          ],
          "text": "Which is why this is fast and cheap: the hard work happened once, offline, for all users — instead of once per request."
        }
      ]
    },
    {
      "id": "why-batch",
      "name": "Batch versus streaming",
      "kind": "notes",
      "steps": [
        {
          "edgeIds": [
            "e_map",
            "e_shuffle",
            "e_reduce"
          ],
          "text": "Batch wins when the answer tolerates being hours old, the computation needs a global view (ranking requires seeing everything), and reprocessing matters — a ranking bug is fixed by rerunning over retained raw events."
        },
        {
          "edgeIds": [
            "e_write"
          ],
          "text": "The failure mode to watch is a silently stale result set: the job fails repeatedly while serving looks perfectly healthy. Monitor result age, not just job success — the same trap as a stale autocomplete trie."
        },
        {
          "edgeIds": [
            "e_read"
          ],
          "text": "Streaming is the answer when freshness is the requirement. Many systems run both — a batch layer for correctness and completeness, a streaming layer for recency — and merge at read time."
        }
      ]
    }
  ]
}
