{
  "schemaVersion": 1,
  "id": "message-delivery",
  "title": "Delivering a message between two connected users",
  "description": "Because connections are stateful, the sender's server has to discover which server holds the recipient's socket. That registry lookup and the inter-server hop are the price of a push-based design.",
  "nodes": [
    { "id": "sender", "type": "client_mobile", "label": "Alice", "sublabel": "sending", "position": { "x": 40, "y": 90 } },
    { "id": "chat_a", "type": "server", "label": "Chat server A", "sublabel": "holds Alice's socket", "position": { "x": 300, "y": 90 } },
    { "id": "chat_b", "type": "server", "label": "Chat server B", "sublabel": "holds Bob's socket", "position": { "x": 640, "y": 90 } },
    { "id": "recipient", "type": "client", "label": "Bob", "sublabel": "receiving", "position": { "x": 900, "y": 90 } },
    { "id": "registry", "type": "cache", "label": "Registry", "sublabel": "user → server, TTL", "position": { "x": 300, "y": 380 }, "badge": 1 },
    { "id": "store", "type": "database_stack", "label": "Message store", "sublabel": "by conversation", "position": { "x": 640, "y": 380 }, "badge": 2 }
  ],
  "edges": [
    { "id": "e_send", "source": "sender", "target": "chat_a", "label": "send (WebSocket)", "step": 1, "sourceHandle": "right", "targetHandle": "left", "direction": "both" },
    { "id": "e_persist", "source": "chat_a", "target": "store", "label": "persist + assign ID", "step": 2, "color": "green", "sourceHandle": "right", "targetHandle": "left" },
    { "id": "e_lookup", "source": "chat_a", "target": "registry", "label": "where is Bob?", "step": 3, "color": "purple", "sourceHandle": "bottom", "targetHandle": "top", "direction": "both" },
    { "id": "e_forward", "source": "chat_a", "target": "chat_b", "label": "forward", "step": 4, "sourceHandle": "right", "targetHandle": "left" },
    { "id": "e_push", "source": "chat_b", "target": "recipient", "label": "push", "step": 5, "sourceHandle": "right", "targetHandle": "left", "direction": "both" }
  ],
  "flows": [
    {
      "id": "online-delivery",
      "name": "Bob is online",
      "steps": [
        { "edgeIds": ["e_send"], "text": "Alice sends over her existing WebSocket. No connection setup — that cost was paid once, when she opened the app." },
        { "edgeIds": ["e_persist"], "text": "The server persists the message first and assigns it a server-side ordering ID. Persisting before delivering is what makes the message survive a crash mid-delivery." },
        { "edgeIds": ["e_lookup"], "text": "It asks the registry which server holds Bob's connection. This lookup exists only because connections are stateful — the tier cannot be load-balanced like a stateless one." },
        { "edgeIds": ["e_forward"], "text": "The message is forwarded to server B over an internal hop." },
        { "edgeIds": ["e_push"], "text": "Server B writes it to Bob's socket. Bob's device acknowledges and advances its cursor." }
      ]
    }
  ]
}
