{
  "schemaVersion": 1,
  "id": "service-boundaries",
  "title": "Where the seams go, and what each hop costs",
  "description": "Splitting the web tier from the application tier lets each scale on its own axis. Splitting further into services buys independence — and charges you latency and availability for every synchronous hop.",
  "groups": [
    { "id": "g_svc", "label": "Services — each owns its data", "position": { "x": 600, "y": 20 }, "size": { "width": 460, "height": 420 }, "style": "dashed", "labelPosition": "top-left" }
  ],
  "nodes": [
    { "id": "clients", "type": "client", "label": "Clients", "position": { "x": 40, "y": 90 } },
    { "id": "web", "type": "server_stack", "label": "Web tier", "sublabel": "stateless · scales on connections", "position": { "x": 290, "y": 85 }, "badge": 1 },
    { "id": "registry", "type": "cache", "label": "Service registry", "sublabel": "healthy instances only", "position": { "x": 300, "y": 380 }, "badge": 2 },
    { "id": "orders", "type": "server_stack", "label": "Orders", "position": { "x": 40, "y": 60 }, "groupId": "g_svc" },
    { "id": "orders_db", "type": "database", "label": "Orders DB", "position": { "x": 260, "y": 60 }, "groupId": "g_svc" },
    { "id": "search", "type": "server_stack", "label": "Search", "sublabel": "scales on CPU", "position": { "x": 40, "y": 250 }, "groupId": "g_svc" },
    { "id": "search_db", "type": "nosql", "label": "Search index", "position": { "x": 260, "y": 250 }, "groupId": "g_svc" },
    { "id": "cost", "type": "text_box", "label": "The bill for each hop", "sublabel": "Availability multiplies: 6 services\nat 99.9% ceiling at 99.4%.\nLatency accumulates, and a\ntransaction spanning services\nbecomes a saga.", "position": { "x": 40, "y": 370 } }
  ],
  "edges": [
    { "id": "e_req", "source": "clients", "target": "web", "label": "HTTP", "step": 1, "sourceHandle": "right", "targetHandle": "left", "direction": "both" },
    { "id": "e_lookup", "source": "web", "target": "registry", "label": "where is Orders?", "step": 2, "color": "purple", "sourceHandle": "bottom", "targetHandle": "top", "direction": "both" },
    { "id": "e_orders", "source": "web", "target": "orders", "label": "call", "step": 3, "color": "green", "sourceHandle": "right", "targetHandle": "left", "direction": "both" },
    { "id": "e_search", "source": "web", "target": "search", "label": "call", "step": 3, "color": "green", "sourceHandle": "right", "targetHandle": "left", "direction": "both" },
    { "id": "e_odb", "source": "orders", "target": "orders_db", "label": "owns", "color": "blue", "sourceHandle": "right", "targetHandle": "left", "direction": "both" },
    { "id": "e_sdb", "source": "search", "target": "search_db", "label": "owns", "color": "blue", "sourceHandle": "right", "targetHandle": "left", "direction": "both" }
  ],
  "flows": [
    {
      "id": "routing",
      "name": "Routing a request",
      "steps": [
        { "edgeIds": ["e_req"], "text": "The web tier terminates HTTP and holds no session state, so any instance can serve any request and the tier scales by changing a number." },
        { "edgeIds": ["e_lookup"], "text": "It resolves a service name to a healthy instance. In practice the platform provides this — a Kubernetes service name resolving to healthy pods is server-side discovery with nothing to build. Knowing when the platform already solved it is part of the answer." },
        { "edgeIds": ["e_orders", "e_search"], "text": "The call goes to a live instance. Orders is I/O-bound and Search is CPU-bound, so they scale on different axes — which is exactly the pressure that justified separating them." }
      ]
    },
    {
      "id": "ownership",
      "name": "Each service owns its data",
      "steps": [
        { "edgeIds": ["e_odb", "e_sdb"], "text": "Each service has exclusive access to its own store, and a different store where that fits — relational for orders, an index for search." },
        { "edgeIds": ["e_orders", "e_search"], "text": "If two services read and write the same tables, they are not separate services. They are one service with a network hop in the middle, and they get the distributed failure modes with none of the independence." },
        { "edgeIds": ["e_odb"], "text": "Follow the data when choosing seams, then the team, then the change rate, then the scale profile. Splitting by technical layer — a 'database service', a 'validation service' — produces services that can never change independently, because every feature touches all of them." }
      ]
    },
    {
      "id": "cost",
      "name": "What decomposition costs",
      "steps": [
        { "edgeIds": ["e_orders", "e_search"], "text": "Availability multiplies downward: six services at 99.9% in a synchronous chain ceiling at 99.4%, roughly two days a year lost to composition alone." },
        { "edgeIds": ["e_lookup"], "text": "Latency accumulates per hop, and fan-out turns a rare slow response into a common slow page — a 1% p99 across 20 calls affects nearly one page in five." },
        { "edgeIds": ["e_odb", "e_sdb"], "text": "And a transaction spanning two services stops being BEGIN/COMMIT and becomes a saga with compensating actions. That is usually the largest hidden cost. Start with a modular monolith and extract when a specific pressure justifies it — \"we would split this out when X becomes true\" is a stronger answer than a diagram with twelve services." }
      ]
    }
  ]
}
